<!ENTITY bookname "javaweb开发">

<!ELEMENT bookshelf (book+)>
<!ELEMENT book (title,author,price)>
<!ELEMENT title (#PCDATA)>
<!ELEMENT author (#PCDATA)>
<!ELEMENT price (#PCDATA)>
